to_remove,CSSE_report_date,fips,location_name,first_fcast_date_impacted,cum_deaths_before_report,cum_deaths_after_report,diff_deaths,error_message
1,2020-06-11,26,Michigan,2020-06-15,5540,5869,329,"Michigan started to report probable cases and probable deaths on June 5. These were combined the probable cases into the confirmed cases, and the probable deaths into the deaths."
0,2020-06-12,29,Missouri,2020-06-15,0,0,0,"Louis City, MO, data for confirmed cases and deaths from March 16 to June 11 were updated to match up with the updated official report at the City of St. Louis dashboard. Date of the first case was updated to March 16, and date of the first deaths was updated to March 23."
1,2020-06-16,41,Oregon,2020-06-22,173,180,7,"June 14th, delay in reporting from Oregon Health Authority resulted in time series for confirmed and deaths not updating. Updated via data from this report. Recovered data was not available for this date."
1,2020-06-22,28,Mississippi,2020-06-24,938,978,40,The spike in cases (and deaths) in Mississippi on June 22 is due to a lack of reporting by the state for the four days prior due to a reported technical issue.
1,2020-06-23,10,Delaware,2020-06-29,435,504,69,Delaware released some probable deaths and identified historical confirmed deaths. 
1,2020-06-25,34,New Jersey,2020-06-29,13076,14872,1796,NJ began reporting probable deaths today and the record for the 25th reflects these 1854 deaths not previously reported. 
1,2020-07-01,36,New York,2020-07-06,20955,22009,1054,The count of New Yorkers who have died of COVID-19 increased by 692. 
1,2020-07-27,48,Texas,2020-08-03,5076,5713,637,"The state of Texas' Department of State Health Services changed their reporting methodology for COVID-19 deaths, resulting in a roughly 13% increase in reported fatalities from the 26th to the 27th. "
0,NA,48,Texas,2020-08-28,5798,6402,604,